{
  "$schema": "https://json-schema.org/draft/2020-12/schema",
  "$id": "https://trustgraphs.xyz/deployments/schema.json",
  "title": "Trustgraphs public release manifest",
  "type": "object",
  "additionalProperties": false,
  "required": [
    "$schema",
    "version",
    "status",
    "stage",
    "chain",
    "chainId",
    "deploymentCommit",
    "firstDeploymentBlock",
    "external",
    "contracts",
    "programs",
    "instances"
  ],
  "allOf": [
    {
      "if": { "properties": { "chain": { "const": "sepolia" } } },
      "then": { "properties": { "chainId": { "const": 11155111 } } }
    },
    {
      "if": { "properties": { "chain": { "const": "mainnet" } } },
      "then": { "properties": { "chainId": { "const": 1 } } }
    }
  ],
  "properties": {
    "$schema": { "type": "string" },
    "version": { "const": 1 },
    "status": { "enum": ["planned", "deployed"] },
    "stage": { "const": "production" },
    "chain": { "enum": ["sepolia", "mainnet"] },
    "chainId": { "type": "integer", "minimum": 1 },
    "deploymentCommit": {
      "oneOf": [
        { "type": "null" },
        { "type": "string", "pattern": "^[0-9a-fA-F]{40}$" }
      ]
    },
    "firstDeploymentBlock": {
      "oneOf": [{ "type": "null" }, { "type": "integer", "minimum": 0 }]
    },
    "external": {
      "type": "object",
      "additionalProperties": false,
      "required": ["eas", "schemaRegistry", "sp1Gateway", "ethUsdFeed", "usdc"],
      "properties": {
        "eas": { "$ref": "#/$defs/address" },
        "schemaRegistry": { "$ref": "#/$defs/address" },
        "sp1Gateway": { "$ref": "#/$defs/nullableAddress" },
        "ethUsdFeed": { "$ref": "#/$defs/nullableAddress" },
        "usdc": { "$ref": "#/$defs/nullableAddress" }
      }
    },
    "contracts": {
      "type": "object",
      "additionalProperties": false,
      "required": [
        "schemaRegistrar",
        "rootVerifier",
        "instanceRegistry",
        "provingVault",
        "trustgraphsFactory",
        "signerVerifier",
        "governedTrustgraphsFactory",
        "signerSyncModuleDeployer",
        "safeSingleton",
        "safeProxyFactory",
        "weightedVerifier",
        "weightedTrustgraphsFactory",
        "governedWeightedTrustgraphsFactory",
        "compositionVerifier",
        "trustComposeFactory",
        "governedTrustComposeFactory",
        "contributionsVerifier",
        "contributionsFactory"
      ],
      "properties": {
        "schemaRegistrar": { "$ref": "#/$defs/deployment" },
        "rootVerifier": { "$ref": "#/$defs/deployment" },
        "instanceRegistry": { "$ref": "#/$defs/deployment" },
        "provingVault": { "$ref": "#/$defs/deployment" },
        "trustgraphsFactory": { "$ref": "#/$defs/deployment" },
        "trustgraphsFactoryFast": { "$ref": "#/$defs/deployment" },
        "signerVerifier": { "$ref": "#/$defs/deployment" },
        "governedTrustgraphsFactory": { "$ref": "#/$defs/deployment" },
        "governedTrustgraphsFactoryFast": { "$ref": "#/$defs/deployment" },
        "signerSyncModuleDeployer": { "$ref": "#/$defs/deployment" },
        "parentAuthorityModuleDeployer": { "$ref": "#/$defs/deployment" },
        "subnetworkRegistry": { "$ref": "#/$defs/deployment" },
        "safeSingleton": { "$ref": "#/$defs/deployment" },
        "safeProxyFactory": { "$ref": "#/$defs/deployment" },
        "weightedVerifier": { "$ref": "#/$defs/deployment" },
        "weightedTrustgraphsFactory": { "$ref": "#/$defs/deployment" },
        "weightedTrustgraphsFactoryFast": { "$ref": "#/$defs/deployment" },
        "governedWeightedTrustgraphsFactory": { "$ref": "#/$defs/deployment" },
        "governedWeightedTrustgraphsFactoryFast": {
          "$ref": "#/$defs/deployment"
        },
        "compositionVerifier": { "$ref": "#/$defs/deployment" },
        "trustComposeFactory": { "$ref": "#/$defs/deployment" },
        "trustComposeFactoryFast": { "$ref": "#/$defs/deployment" },
        "governedTrustComposeFactory": { "$ref": "#/$defs/deployment" },
        "governedTrustComposeFactoryFast": { "$ref": "#/$defs/deployment" },
        "contributionsVerifier": { "$ref": "#/$defs/deployment" },
        "contributionsFactory": { "$ref": "#/$defs/deployment" },
        "contributionsFactoryFast": { "$ref": "#/$defs/deployment" }
      }
    },
    "programs": {
      "type": "object",
      "additionalProperties": false,
      "required": [
        "trustGraph",
        "weighted",
        "composition",
        "signer",
        "contributions",
        "hypercerts",
        "nostrWorkspace"
      ],
      "properties": {
        "trustGraph": {
          "type": "object",
          "additionalProperties": false,
          "required": ["sp1Version", "elfSha256", "vkey"],
          "properties": {
            "sp1Version": { "enum": ["6.3.1", "6.6.0"] },
            "elfSha256": { "$ref": "#/$defs/nullableBytes32" },
            "vkey": { "$ref": "#/$defs/nullableBytes32" }
          }
        },
        "signer": {
          "type": "object",
          "additionalProperties": false,
          "required": ["sp1Version", "elfSha256", "vkey"],
          "properties": {
            "sp1Version": { "enum": ["6.3.1", "6.6.0"] },
            "elfSha256": { "$ref": "#/$defs/nullableBytes32" },
            "vkey": { "$ref": "#/$defs/nullableBytes32" }
          }
        },
        "weighted": {
          "$ref": "#/$defs/program"
        },
        "composition": {
          "$ref": "#/$defs/program"
        },
        "contributions": {
          "$ref": "#/$defs/program"
        },
        "hypercerts": {
          "$ref": "#/$defs/program"
        },
        "nostrWorkspace": {
          "$ref": "#/$defs/program"
        }
      }
    },
    "instances": {
      "type": "array",
      "items": {
        "type": "object",
        "additionalProperties": false,
        "required": ["instanceId", "name", "contracts", "schemaUid"],
        "properties": {
          "instanceId": { "$ref": "#/$defs/bytes32" },
          "name": { "type": "string", "minLength": 1 },
          "schemaUid": { "$ref": "#/$defs/bytes32" },
          "contracts": {
            "type": "object",
            "additionalProperties": false,
            "required": ["merkleSnapshot", "easIndexerResolver"],
            "properties": {
              "merkleSnapshot": { "$ref": "#/$defs/address" },
              "easIndexerResolver": { "$ref": "#/$defs/address" },
              "merkleFundDistributor": { "$ref": "#/$defs/address" },
              "paramsController": { "$ref": "#/$defs/address" }
            }
          }
        }
      }
    },
    "trustPools": {
      "type": "array",
      "items": {
        "type": "object",
        "additionalProperties": false,
        "required": ["governor", "pool"],
        "properties": {
          "governor": { "$ref": "#/$defs/address" },
          "pool": { "$ref": "#/$defs/deployment" }
        }
      }
    }
  },
  "$defs": {
    "address": {
      "type": "string",
      "pattern": "^0x[0-9a-fA-F]{40}$"
    },
    "bytes32": {
      "type": "string",
      "pattern": "^0x[0-9a-fA-F]{64}$"
    },
    "nullableAddress": {
      "oneOf": [{ "type": "null" }, { "$ref": "#/$defs/address" }]
    },
    "nullableBytes32": {
      "oneOf": [{ "type": "null" }, { "$ref": "#/$defs/bytes32" }]
    },
    "deployment": {
      "type": "object",
      "additionalProperties": false,
      "required": ["address", "block", "txHash"],
      "properties": {
        "address": { "$ref": "#/$defs/nullableAddress" },
        "block": {
          "oneOf": [{ "type": "null" }, { "type": "integer", "minimum": 0 }]
        },
        "txHash": { "$ref": "#/$defs/nullableBytes32" }
      }
    },
    "program": {
      "type": "object",
      "additionalProperties": false,
      "required": ["sp1Version", "elfSha256", "vkey"],
      "properties": {
        "sp1Version": { "enum": ["6.3.1", "6.6.0"] },
        "elfSha256": { "$ref": "#/$defs/nullableBytes32" },
        "vkey": { "$ref": "#/$defs/nullableBytes32" }
      }
    }
  }
}
